org_id,ein,name,category,ntee_major,ntee_full,city,state
org_003819,593319814,Teen Challenge Job Training Inc,Religion,X,X21Z,Columbus,GA
org_003820,391302520,Freedom From Religion Foundation Inc,Religion,X,X20Z,Madison,WI
org_003821,222714023,American Baptist Foundation,Religion,X,X11,Kng Of Prussa,PA
org_003822,330686464,Equip Leadership Inc,Religion,X,X21,Duluth,GA
org_003823,620841438,Precept Ministries Of Reach Out Inc,Religion,X,X99,Chattanooga,TN
org_003824,752980638,St Paul Center For Biblical Theology,Religion,X,X20,Steubenville,OH
org_003825,731387441,Les Feldick Ministries,Religion,X,X20Z,Kinta,OK
org_003826,471291052,Honeymoon Israel Foundation Inc,Religion,X,X30,Atlanta,GA
org_003827,921861278,Decoster Family Charitable Foundation,Religion,X,X12,Turner,ME
org_003828,133275531,Ohr Torah Stone Institutions Of Isr Ael,Religion,X,X300,New York,NY
org_003829,237060038,Muslim Community Center Incorporate,Religion,X,X40Z,Chicago,IL
org_003830,941442453,Loam Media Inc,Religion,X,X20,Franklin,TN
org_003831,954507478,El Sembrador Ministries,Religion,X,X21Z,Chatsworth,CA
org_003832,141888977,Unfoldingword,Religion,X,X02,Orlando,FL
org_003833,362004402,Cbmc Inc,Religion,X,X21Z,Chattanooga,TN
org_003834,262986750,Brahmananda Saraswati Foundation,Religion,X,X12,Fairfield,IA
org_003835,366108515,Institute In Basic Life Principles,Religion,X,X200,Big Sandy,TX
org_003836,264300687,Rhema For The Nations Inc,Religion,X,X83,Arlington,TX
org_003837,460422866,Evangelical Lutheran Good Samaritan Foundation,Religion,X,X20,Sioux Falls,SD
org_003838,720965379,City Of Faith Prison Ministries,Religion,X,X21Z,Monroe,LA
org_003839,10797083,Desiring God Ministries,Religion,X,X20,Minneapolis,MN
org_003840,364629406,Stewardship Endowment Fund,Religion,X,X112,Scottsdale,AZ
org_003841,364092893,G O Ministries Inc,Religion,X,X20,Louisville,KY
org_003842,820472704,Community Development Inc,Religion,X,X20,Garden City,ID
org_003843,203826376,Launch Global,Religion,X,X99,Dallas,TX
org_003844,454971921,Impact 360 Institute Inc,Religion,X,X99,Pine Mountain,GA
org_003845,202777557,J Street Education Fund Inc,Religion,X,X90,Washington,DC
org_003846,731300662,Southern Oklahoma Memorial Foundation Inc,Religion,X,X99Z,Ardmore,OK
org_003847,311384480,Independent Baptist Mission For Asians Inc,Religion,X,X20,Marietta,OH
org_003848,454268490,Yeshiva Gedolah Keren Hatorah Inc,Religion,X,X30,Lakewood,NJ
org_003849,752530931,Marriage Today,Religion,X,X20,Southlake,TX
org_003850,464715368,Onetable Inc,Religion,X,X03,New York,NY
org_003851,841720344,Global Media Outreach,Religion,X,X200,Dallas,TX
org_003852,931141153,Dynamic Life Inc,Religion,X,X20,Keizer,OR
org_003853,200808497,Rescue International,Religion,X,X20,Rochester,MI
org_003854,814837230,Vision Baptist Missions Inc,Religion,X,X21,Dawsonville,GA
org_003855,237031965,Christian Light Publications Inc,Religion,X,X20Z,Harrisonburg,VA
org_003856,270431140,Yeshivat Lev Torah,Religion,X,X30,Brooklyn,NY
org_003857,591148710,Florida Methodist Foundation Inc,Religion,X,X120,Lakeland,FL
org_003858,822194134,American Friends Of Zavat Chalav Inc,Religion,X,X30,Airmont,NY
org_003859,232070710,Jubilee Ministries,Religion,X,X99,Lebanon,PA
org_003860,311650883,Religion News Foundation,Religion,X,X11,Columbia,MO
org_003861,480697195,Kansas Methodist Foundation Inc,Religion,X,X21,Hutchinson,KS
org_003862,680586399,Global Training Network Inc,Religion,X,X20,Peoria,AZ
org_003863,383447967,Our Daily Bread Ministries Foundation,Religion,X,X120,Grand Rapids,MI
org_003864,133266145,Community Association Of Progressive Dominicans Inc,Religion,X,X22Z,Bronx,NY
org_003865,232831830,Greater Hazleton Health Alliance,Religion,X,X00Z,Hazleton,PA
org_003866,870643778,Christian Center Of Park City,Religion,X,X21,Park City,UT
org_003867,367180671,The Robert E Gallagher Charitable Trust,Religion,X,X99Z,Glenview,IL
org_003868,208690051,Kingdom Advisors Inc,Religion,X,X80,Atlanta,GA
org_003869,822016290,Society Of St Vincent De Paul Peoria Council,Religion,X,X20,Peoria,IL
org_003870,300222202,Praying Pelican Missions,Religion,X,X20,Minneapolis,MN
org_003871,883748425,Sacred Spaces Foundation,Religion,X,X99,Arlington,VA
org_003872,452403156,Jewish Foundation Of Greater New Haven Inc,Religion,X,X113,Woodbridge,CT
org_003873,330724945,Path Of Life Ministries,Religion,X,X20,Riverside,CA
org_003874,474084390,Oneshare International,Religion,X,X20,Madison,VA
org_003875,262193509,Lighthouse Catholic Media Nfp,Religion,X,X80,Sycamore,IL
org_003876,463250017,Brahmananda Saraswati Yagya Foundation,Religion,X,X99,Fairfield,IA
org_003877,921154296,Open Doors International Usa Inc,Religion,X,X12,Santa Ana,CA
org_003878,223834440,Christian Union Inc,Religion,X,X20,Princeton,NJ
org_003879,921070799,Lifestone Ministries Inc,Religion,X,X80,Middlebrg Hts,OH
org_003880,854275305,Troy Brewer Charitable Network,Religion,X,X80,Burleson,TX
org_003881,841423634,Dutch Sheets Ministries Inc,Religion,X,X21,Batsbrg Levil,SC
org_003882,463787418,Catholic Church Support Services,Religion,X,X22,Oakland,CA
org_003883,364021430,John Mark Co,Religion,X,X99,Crete,IL
org_003884,853235718,Church At The Park,Religion,X,X20,Salem,OR
org_003885,561762654,Holy Angels Foundation Inc,Religion,X,X20,Belmont,NC
org_003886,460743399,Serving Usa Inc,Religion,X,X20,Camas,WA
org_003887,760692185,Southern Usa Falun Dafa Association,Religion,X,X50,Houston,TX
org_003888,371363355,United Methodist Village Retirement Communities Inc,Religion,X,X99,Godfrey,IL
org_003889,720812234,Aloysius J & Eugene F Franz Foundation For The Congregation Of,Religion,X,X110,Philadelphia,PA
org_003890,382602775,Lenawee Christian Ministries,Religion,X,X192,Adrian,MI
org_003891,912167303,Khyentse Foundation,Religion,X,X50,San Francisco,CA
org_003892,261422898,Israel Education Resource,Religion,X,X30,Northbrook,IL
org_003893,731427376,The Provision Group Inc,Religion,X,X21Z,Tulsa,OK
org_003894,814107324,Catholic Foundation Of Michigan,Religion,X,X12,Bloomfld Hls,MI
org_003895,311753320,Prison Fellowship Ministries Foundation,Religion,X,X11,Lansdowne,VA
org_003896,363529801,Agudath Israel Of Illinois,Religion,X,X30Z,Chicago,IL
org_003897,541563242,Reaching Unreached Nations Inc,Religion,X,X99Z,Virginia Bch,VA
org_003898,205294264,Book Of Mormon Central,Religion,X,X99,American Fork,UT
org_003899,871553736,James L And Mary D Macfarlane Charitable Foundation,Religion,X,X12,Dallas,TX
org_003900,920146203,Kodiak Island Health Care Foundation,Religion,X,X99Z,Kodiak,AK
org_003901,351076405,World Missionary Press Inc,Religion,X,X830,New Paris,IN
org_003902,932111530,Alliance Defending Freedom International,Religion,X,X20,Lansdowne,VA
org_003903,760555299,Carolina Creek Christian Camp,Religion,X,X20,Huntsville,TX
org_003904,223412504,Holy Name Real Estate Corp,Religion,X,X99,Teaneck,NJ
org_003905,231381400,Infaith,Religion,X,X200,Exton,PA
org_003906,870657642,Sower Of Seeds International Ministries Inc,Religion,X,X20,Keller,TX
org_003907,135628475,Zionist Organization Of America,Religion,X,X30,New York,NY
org_003908,450967206,Praxis Inc,Religion,X,X022,New York,NY
org_003909,591739036,Christian Television Corporation Inc,Religion,X,X820,Largo,FL
org_003910,541591635,Loudoun Hunger Relief,Religion,X,X20Z,Leesburg,VA
org_003911,814838703,Tomchei Tzedaka Corp,Religion,X,X30,Lakewood,NJ
org_003912,223249506,Noor Uliman Schools Inc,Religion,X,X99Z,Monmouth Jct,NJ
org_003913,463057485,Jcc Charitable Project Inc,Religion,X,X30,Tampa,FL
org_003914,751645187,Christian Motorcyclists Assn Inc,Religion,X,X20,Hatfield,AR
org_003915,465072086,Mission Springs Camps And Conference Center Inc,Religion,X,X20,Scotts Valley,CA
org_003916,462662312,Campus Outreach Serve Inc,Religion,X,X99,Hoover,AL
org_003917,200743864,Faith And Learning International Nfp,Religion,X,X20,Wheaton,IL
org_003918,465045525,Sail School For Arts Infused Learning,Religion,X,X20,Evans,GA
org_003919,841295381,Crossfire Ministries Inc,Religion,X,X21,Colorado Spgs,CO
org_003920,462719381,Glorieta 2 0 Inc,Religion,X,X20,Glorieta,NM
org_003921,460567613,Zaka North Inc,Religion,X,X12,Brooklyn,NY
org_003922,731618309,International Pentecostal Holiness Foundation Inc,Religion,X,X12,Southern Pnes,NC
org_003923,571154204,Resourcing Christian Education International Nfp,Religion,X,X20,Wheaton,IL
org_003924,942565270,Pep Housing,Religion,X,X90Z,Santa Rosa,CA
org_003925,521485481,Support Our Aging Religious Inc Soar,Religion,X,X11,Silver Spring,MD
org_003926,841617179,Swaminarayan Aksharpith Inc,Religion,X,X70,Windsor,NJ
org_003927,363304707,Lutheran Services In America Incorporated,Religion,X,X20,Washington,DC
org_003928,112507910,Federation Of Italian American Org Of Brooklyn Ltd,Religion,X,X40,Brooklyn,NY
org_003929,462465164,Torah Center For Higher Rabbinical Studies Inc,Religion,X,X80,Brooklyn,NY
org_003930,61023010,Padre Pio Foundation Of America Inc,Religion,X,X22Z,Cromwell,CT
org_003931,231504141,Lancaster County Christian School,Religion,X,X20Z,Lancaster,PA
org_003932,352606291,New Generations,Religion,X,X20,Wheaton,IL
org_003933,465506318,Friends Of The Great Commission,Religion,X,X20,Colorado Spgs,CO
org_003934,621574495,Knoxville Leadership Foundation,Religion,X,X83,Knoxville,TN
org_003935,230891430,Morning Cheer Inc,Religion,X,X200,North East,MD
org_003936,753077433,Bfp International Inc,Religion,X,X20,Tulsa,OK
org_003937,751439170,Baptist Church Loan Corporation,Religion,X,X120,Dallas,TX
org_003938,582535153,Mcmichael Communications Group Inc,Religion,X,X112,Atlanta,GA
org_003939,332067771,Metanoia Inc,Religion,X,X22,New Haven,CT
org_003940,473080879,Curt Landry Ministries International,Religion,X,X20,Fairland,OK
org_003941,882396474,Clearshare Health,Religion,X,X20,Austin,TX
org_003942,721621579,Frontline Response International Inc,Religion,X,X20,Atlanta,GA
org_003943,222548708,Sophia Institute Press,Religion,X,X30,Manchester,NH
org_003944,10461436,Genesis Fund,Religion,X,X20J,Brunswick,ME
org_003945,201523797,American Friends Of Kupat Hair Inc,Religion,X,X30,Brooklyn,NY
org_003946,237418355,Nora Lam Ministries,Religion,X,X21,San Jose,CA
org_003947,271286258,Chesterfield Food Bank,Religion,X,X21,Chester,VA
org_003948,901117779,The Colson Center For Christian Worldview,Religion,X,X20,Colorado Spgs,CO
org_003949,237422390,Heart Consciousness Church Inc,Religion,X,X200,Middletown,CA
org_003950,271486415,Archdiocese Of Indianapolis Cemeteries Inc,Religion,X,X192,Indianapolis,IN
org_003951,752990530,Esperanza Charitable Fund,Religion,X,X21,Mesa,AZ
org_003952,231501815,Christian School Association Of York Inc,Religion,X,X20Z,York,PA
org_003953,841358029,Simchat Torah Beit Midrash,Religion,X,X30Z,Parker,CO
org_003954,741168931,Presbyterian Mo Ranch Assembly,Religion,X,X200,Hunt,TX
org_003955,237428762,Church Of The Pioneers Foundation,Religion,X,X20,Menlo Park,CA
org_003956,237188767,National Ghost Ranch Foundation Inc,Religion,X,X20Z,Abiquiu,NM
org_003957,522367676,Masters Academy International Inc,Religion,X,X20,Sun Valley,CA
org_003958,453969752,Christian Aid Ministries Foundation,Religion,X,X19,Berlin,OH
org_003959,854232641,House To House Inc,Religion,X,X20,Dalton,GA
org_003960,273346714,Impact Network Inc,Religion,X,X82,Detroit,MI
org_003961,942427126,Hindu Community And Cultural Center,Religion,X,X70Z,Livermore,CA
org_003962,133856954,Knickerbocker Properties Inc Xx,Religion,X,X99,New York,NY
org_003963,821585100,Global Serve International Inc,Religion,X,X20,Bradenton,FL
org_003964,942714877,Roman Catholic Communications Corporation Of The Bay Area,Religion,X,X22Z,Menlo Park,CA
org_003965,251738347,Las Geriatric Care Services Inc,Religion,X,X00Z,Mars,PA
org_003966,752785010,New Life Ministries,Religion,X,X21,Richardson,TX
org_003967,751779401,Wichita Falls Faith Mission Inc,Religion,X,X20Z,Wichita Falls,TX
org_003968,61531224,Faith Broadcasting Network Inc,Religion,X,X20,Marion,IL
org_003969,205616941,The Veritas Forum Inc,Religion,X,X80,Cambridge,MA
org_003970,381417381,Geneva Camp & Retreat Center,Religion,X,X200,Holland,MI
org_003971,367092282,The Christopher Family Foundation,Religion,X,X99Z,Westmont,IL
org_003972,382776542,Legatus,Religion,X,X22Z,Ann Arbor,MI
org_003973,770566530,Christian Foundation Of America,Religion,X,X12,Westlake Village,CA
org_003974,453458120,Magen Abraham Yeshiva Inc,Religion,X,X30,Brooklyn,NY
org_003975,204423661,Muslim Association Of Puget Sound,Religion,X,X99,Redmond,WA
org_003976,951644608,The Fid Group,Religion,X,X99,Pasadena,CA
org_003977,550798282,College Golf Fellowship,Religion,X,X99,Roseville,CA
org_003978,943372543,Libitzky Family Foundation,Religion,X,X123,San Francisco,CA
org_003979,201260545,Jewish Community Foundation Inc,Religion,X,X113,Cherry Hill,NJ
org_003980,561889818,The Church Initiative Inc,Religion,X,X99Z,Wake Forest,NC
org_003981,731019628,Reaching Souls International Inc,Religion,X,X21Z,Oklahoma City,OK
org_003982,411652782,International Messengers,Religion,X,X21Z,Clear Lake,IA
org_003983,411314577,C R O S S Christians Reaching Out In Social Service,Religion,X,X02,Rogers,MN
org_003984,202850305,Mikvah Usa Inc,Religion,X,X30,Brooklyn,NY
org_003985,823953939,White Lotus Philanthropy Ltd,Religion,X,X12,Mamaroneck,NY
org_003986,873690713,Jewish Community Of Canton Llc,Religion,X,X30,Canton,OH
org_003987,462354815,Avant Garde Academy Inc,Religion,X,X99,Kissimmee,FL
org_003988,570624226,Student Leadership University Inc,Religion,X,X20,Winter Park,FL
org_003989,463986960,New Reformation Publications,Religion,X,X83,San Clemente,CA
org_003990,680351133,Saiva Siddhantha Ashram,Religion,X,X99Z,Concord,CA
org_003991,822744094,Encounter Ministry Inc,Religion,X,X99,Roach,MO
org_003992,813739789,Jewbelong Inc,Religion,X,X30,New York,NY
org_003993,431700240,Barnabas Foundation Inc,Religion,X,X20,Branson,MO
org_003994,300265118,Helping Hands Support Inc,Religion,X,X19,Sarasota,FL
org_003995,593123555,Messenger International Inc,Religion,X,X20,Monument,CO
org_003996,362495289,Chicago Rabbinical Council Inc,Religion,X,X99,Chicago,IL
org_003997,813151773,Cpps Heritage Mission Fund,Religion,X,X12,Dayton,OH
org_003998,832103988,Jewish Columbus,Religion,X,X30,Columbus,OH
org_003999,381415401,The Officers Christian Fellowship Of The United States Of America,Religion,X,X20Z,Colorado Spgs,CO
org_004000,900424876,Uaw Retiree Medical Benefits Tr,Mutual & Membership Benefit,Y,Y43,Detroit,MI
org_004001,113601529,Boeing Company Veba Master Trust,Mutual & Membership Benefit,Y,Y43,Brooklyn,NY
org_004002,133093382,Jpmorgan Chase Veba Trust For Active Employees,Mutual & Membership Benefit,Y,Y43,Jersey City,NJ
org_004003,957055654,Bankamerica Group Benefits Program Tr,Mutual & Membership Benefit,Y,Y43,Dallas,TX
org_004004,60416470,Knights Of Columbus,Mutual & Membership Benefit,Y,Y41,New Haven,CT
org_004005,800721489,Tufts Health Public Plans Inc,Mutual & Membership Benefit,Y,Y20,Canton,MA
org_004006,131628401,1199 National Benefit Fund For Hospital & Human Service Employees,Mutual & Membership Benefit,Y,Y43,New York,NY
org_004007,953386394,Northrop Grumman Veba Master Trust I,Mutual & Membership Benefit,Y,Y20Z,Quincy,MA
org_004008,560995910,North Carolina Electric Membership Corporation,Mutual & Membership Benefit,Y,Y22,Raleigh,NC
org_004009,753261600,Delta Account Based Medical Tr,Mutual & Membership Benefit,Y,Y43,Atlanta,GA
org_004010,912171891,Lokahi Assurance Ltd,Mutual & Membership Benefit,Y,Y200,Oakland,CA
org_004011,231667011,Delta Dental Of Pennsylvania,Mutual & Membership Benefit,Y,Y20,Camp Hill,PA
org_004012,367274697,Accenture United States Benefit,Mutual & Membership Benefit,Y,Y43,Chicago,IL
org_004013,111980218,Delta Dental Of New York Inc,Mutual & Membership Benefit,Y,Y20,New York,NY
org_004014,753198514,Neca Ibew Family Medical Care Tr Fund,Mutual & Membership Benefit,Y,Y43,Rockville,MD
org_004015,751848557,Baylor Health Care Systems Employee Welfare Benefit Trust,Mutual & Membership Benefit,Y,Y43,Dallas,TX
org_004016,813220497,130 Regional Water Sypply Corporation,Mutual & Membership Benefit,Y,Y22,Round Rock,TX
org_004017,746491264,Chs Community Health Systems Inc Veba Trust,Mutual & Membership Benefit,Y,Y43,Franklin,TN
org_004018,135562401,Young Mens Christian Association Retirement Fund,Mutual & Membership Benefit,Y,Y300,New York,NY
org_004019,522174651,National Railway Carriers & United Trans Union Health & Welfare Plan,Mutual & Membership Benefit,Y,Y43,Arlington,VA
org_004020,461828839,Fiat Lux Risk And Insurance Company,Mutual & Membership Benefit,Y,Y20,Washington,DC
org_004021,237336001,New York State Nurses Association Benefit Fund,Mutual & Membership Benefit,Y,Y43,Albany,NY
org_004022,471277622,Southern Ohio Chamber Alliance Benefit Plan,Mutual & Membership Benefit,Y,Y43,Cincinnati,OH
org_004023,816220828,United Airlines Employee Sick Leave Tr,Mutual & Membership Benefit,Y,Y43,Chicago,IL
org_004024,742624710,Bae Systems North America Welfare Benefit Trust,Mutual & Membership Benefit,Y,Y43,Falls Church,VA
org_004025,746528872,Kpmg Llp Health Plans Tr,Mutual & Membership Benefit,Y,Y43,Montvale,NJ
org_004026,451295465,Montana Health Cooperative,Mutual & Membership Benefit,Y,Y20,Helena,MT
org_004027,251809780,Bp Corporation North America Inc Veba Master Trust,Mutual & Membership Benefit,Y,Y43,Houston,TX
org_004028,201842198,Seiu Healthcare Nw Health Benefits Trust,Mutual & Membership Benefit,Y,Y43,Seattle,WA
org_004029,752871400,United Electric Cooperative Services Inc,Mutual & Membership Benefit,Y,Y22,Cleburne,TX
org_004030,831289985,Georgia Chamber Federation Benefit Plan Trust,Mutual & Membership Benefit,Y,Y43,Atlanta,GA
org_004031,743023938,Guadalupe Valley Electric Cooperative Inc,Mutual & Membership Benefit,Y,Y22,Gonzales,TX
org_004032,367046706,Ascension Health Professional And General Liability Self Insurance,Mutual & Membership Benefit,Y,Y200,Saint Louis,MO
org_004033,980040652,University Of B C Pension Plan For Members Of The Academic Staff,Mutual & Membership Benefit,Y,Y30Z,Canada,
org_004034,453416923,Maine Community Health Options,Mutual & Membership Benefit,Y,Y20,New Gloucestr,ME
org_004035,410571990,St Paul Teachers Retirement Fund Association,Mutual & Membership Benefit,Y,Y33,Saint Paul,MN
org_004036,131595091,New York Trades Council & Hotel Association Of New York City,Mutual & Membership Benefit,Y,Y20,New York,NY
org_004037,237268394,International City Management Association Retirement Corporation,Mutual & Membership Benefit,Y,Y30,Washington,DC
org_004038,200422657,Labor Management Healthcare Fund,Mutual & Membership Benefit,Y,Y43,Cheektowaga,NY
org_004039,256702878,Prudential Welfare Benefits Tr,Mutual & Membership Benefit,Y,Y43,Newark,NJ
org_004040,113805568,Gene Upshaw Nfl Player Health Reimbursement Account Plan Trust,Mutual & Membership Benefit,Y,Y43,Baltimore,MD
org_004041,366551984,Employee Benefit Trust Of Harris Trust And Savings Bank And,Mutual & Membership Benefit,Y,Y43,Pittsburgh,PA
org_004042,462980181,Delaware County Public Schools Healthcare Trust,Mutual & Membership Benefit,Y,Y20,Morton,PA
org_004043,135537605,Mason Tenders District Council Welfare Fund,Mutual & Membership Benefit,Y,Y43,New York,NY
org_004044,450593187,Central Midwest Regional Council Of Carpenters Welfare Fund,Mutual & Membership Benefit,Y,Y43,Troy,MI
org_004045,351589453,Eli Lilly & Co Master Trust For Employee Benefits,Mutual & Membership Benefit,Y,Y43,Indianapolis,IN
org_004046,686068469,Insurance And Benefits Tr Of Peace Officers Research Assoc Of Ca,Mutual & Membership Benefit,Y,Y43,Sacramento,CA
org_004047,416383796,Xcel Energy Inc Voluntary Employees Benefciary Trust For Active Employ,Mutual & Membership Benefit,Y,Y43,Minneapolis,MN
org_004048,874039849,Constellation Employees Benefit Trust,Mutual & Membership Benefit,Y,Y43,Kennett Square,PA
org_004049,116490308,International Brotherhood Of Trade Unions Health & Welfare Fd Tr,Mutual & Membership Benefit,Y,Y430,Carle Place,NY
org_004050,463158991,Tml Multistate Intergovernmental Employee Benefits,Mutual & Membership Benefit,Y,Y44,Austin,TX
org_004051,820907005,Missouri Chamber Federation Benefit Plan Trust,Mutual & Membership Benefit,Y,Y43,Jefferson Cty,MO
org_004052,150551885,New York State Teamsters Council Health & Hospital Fund,Mutual & Membership Benefit,Y,Y43,Syracuse,NY
org_004053,306599079,Bank Of Amercia Retiree Group Benefits Program,Mutual & Membership Benefit,Y,Y43,Dallas,TX
org_004054,943131623,Voluntary Employees Beneficiary Assoc Tr For Pub Empl State Of Wa,Mutual & Membership Benefit,Y,Y44,Spokane,WA
org_004055,100001927,At&T Corp Management & Nonrepresent Employees Postretirement Welfare,Mutual & Membership Benefit,Y,Y430,Dallas,TX
org_004056,376395038,Rbc Usa Health & Welfare Benefit Pl Intrvs Tr,Mutual & Membership Benefit,Y,Y43,Jersey City,NJ
org_004057,920174160,Asea Afscme Local 52 Health Benefits Trust,Mutual & Membership Benefit,Y,Y43,Spokane,WA
org_004058,990346113,Kauai Island Utility Cooperative,Mutual & Membership Benefit,Y,Y22,Lihue,HI
org_004059,431601369,Ascension Welfare Benefits Trust,Mutual & Membership Benefit,Y,Y43,Saint Louis,MO
org_004060,900166428,United Airlines Pilot Retiree Health Account Plan,Mutual & Membership Benefit,Y,Y44,Chicago,IL
org_004061,951867598,Southern California Pipe Trades Health And Welfare Fund,Mutual & Membership Benefit,Y,Y43,Los Angeles,CA
org_004062,860176697,Arizona Electric Power Cooperative Inc,Mutual & Membership Benefit,Y,Y43,Benson,AZ
org_004063,66414276,Yale University Retiree Health Benefits Coverage Tr,Mutual & Membership Benefit,Y,Y430,New Haven,CT
org_004064,870806881,Brazos Sandy Creek Electric Cooperative Inc,Mutual & Membership Benefit,Y,Y22,Houston,TX
org_004065,816631261,Operating Engineers Local Union No 3 Vacation Holiday And Sick Pay,Mutual & Membership Benefit,Y,Y35,Alameda,CA
org_004066,205988744,Washington Saratoga Warren Hamiltonessex Counties Health Ins Consorti,Mutual & Membership Benefit,Y,Y44,Wilton,NY
org_004067,471372682,Idaho School District Council Self Funded Benefit Trust,Mutual & Membership Benefit,Y,Y44,Boise,ID
org_004068,133914183,Veba Trust For Union Employees Of Keyspan Corporation,Mutual & Membership Benefit,Y,Y43,Pittsburgh,PA
org_004069,266330284,Retirees Of The Goodyear Tire & Rubber Company Health Care Tr,Mutual & Membership Benefit,Y,Y43,Pittsburgh,PA
org_004070,926253795,Ameren Active Employee Healthcare Tr,Mutual & Membership Benefit,Y,Y43,Saint Louis,MO
org_004071,581403006,Life Care Centers Of America Inc Associate Benefit Trust,Mutual & Membership Benefit,Y,Y43,Cleveland,TN
org_004072,367045813,Cnh Welfare Benefit Trust,Mutual & Membership Benefit,Y,Y43,Racine,WI
org_004073,431948188,Bluegrass Energy Cooperative Corp,Mutual & Membership Benefit,Y,Y22,Nicholasville,KY
org_004074,311639556,Sodexho Inc,Mutual & Membership Benefit,Y,Y43,N Bethesda,MD
org_004075,276318504,Carrier Ila Container Royalty Fund No 5,Mutual & Membership Benefit,Y,Y43,Lyndhurst,NJ
org_004076,367481494,Business Health Tr,Mutual & Membership Benefit,Y,Y43,Mukilteo,WA
org_004077,141886527,Ny44 Health Benefits Plan Tr,Mutual & Membership Benefit,Y,Y44,West Seneca,NY
org_004078,262336180,Seiu Healthcare Il Home Care & Child Care Fund,Mutual & Membership Benefit,Y,Y430,Chicago,IL
org_004079,460591172,Mondelez Global Llc Group Benefit Trust I,Mutual & Membership Benefit,Y,Y43,New York,NY
org_004080,760266124,United Airlines Inc,Mutual & Membership Benefit,Y,Y43,Lewisville,TX
org_004081,465243652,Chicago & Vicinity Laborers Distrct Cncil Retire Health & Welfare Plan,Mutual & Membership Benefit,Y,Y44,Westchester,IL
org_004082,521036978,Felra And Ufcw Health And Welfare Fund,Mutual & Membership Benefit,Y,Y43,Sparks,MD
org_004083,412261950,District Council 16 Northern California Health And Welfare Trus,Mutual & Membership Benefit,Y,Y43,Dublin,CA
org_004084,461056754,Chesapeake Employers Insurance Comp Any,Mutual & Membership Benefit,Y,Y25,Towson,MD
org_004085,770203935,Nonprofits Insurance Alliance Of California,Mutual & Membership Benefit,Y,Y200,Santa Cruz,CA
org_004086,223323698,Gpu Companies Health Care Plan For Nonbargaining Retirees,Mutual & Membership Benefit,Y,Y43,Heritage Dr N Qu,MA
org_004087,134129368,1199 Seiu National Benefit Fund For Home Care Employees,Mutual & Membership Benefit,Y,Y43,New York,NY
org_004088,921854391,Hca Short Term Disability Benefits Plan Trust,Mutual & Membership Benefit,Y,Y43,Nashville,TN
org_004089,911214669,Voluntary Employees Benefit Association Trust For Public,Mutual & Membership Benefit,Y,Y43,Spokane,WA
org_004090,461020794,Bucks & Montgomery County & Schools Health Care Consortium,Mutual & Membership Benefit,Y,Y43,Doylestown,PA
org_004091,467526272,Paisboa Health Benefit Tr,Mutual & Membership Benefit,Y,Y20,Wayne,PA
org_004092,306454119,Bank Of America Short Term Disability Plan Trust,Mutual & Membership Benefit,Y,Y43,Dallas,TX
org_004093,411416156,Northwest Fire Fighters Benefits Trust,Mutual & Membership Benefit,Y,Y43,Mukilteo,WA
org_004094,476322653,Ozark Schools Benefits Association,Mutual & Membership Benefit,Y,Y44,Bolivar,MO
org_004095,261574455,Ocu Health & Welfare Trust,Mutual & Membership Benefit,Y,Y44,Covina,CA
org_004096,841749555,Wells Fargo & Company Short Term Disability Plan & Trust,Mutual & Membership Benefit,Y,Y43,Des Moines,IA
org_004097,222994116,Massachusetts Life And Health Insurance Guaranty Association,Mutual & Membership Benefit,Y,Y20Z,Springfield,MA
org_004098,274344749,United States Steel Corporation Retiree Insurance Benefits Trust,Mutual & Membership Benefit,Y,Y43,Pittsburgh,PA
org_004099,990289310,Sutter Insurance Services Corporation,Mutual & Membership Benefit,Y,Y20,Honolulu,HI
org_004100,61555320,Alliance Of Nonprofits For Insurance Risk Retention Group Inc,Mutual & Membership Benefit,Y,Y20,Santa Cruz,CA
