org_id,ein,name,category,ntee_major,ntee_full,city,state
org_000000,530206027,Smithsonian Institute,"Arts, Culture & Humanities",A,A50Z,Washington,DC
org_000001,131624086,The Metropolitan Museum Of Art,"Arts, Culture & Humanities",A,A510,New York,NY
org_000002,520899215,Public Broadcasting Service,"Arts, Culture & Humanities",A,A320,Arlington,VA
org_000003,953510046,Crystal Stairs Inc,"Arts, Culture & Humanities",A,A25,Los Angeles,CA
org_000004,520907625,National Public Radio Inc,"Arts, Culture & Humanities",A,A340,Washington,DC
org_000005,131624100,Museum Of Modern Art,"Arts, Culture & Humanities",A,A510,New York,NY
org_000006,43177990,Harvard Business School Publishing Corporation,"Arts, Culture & Humanities",A,A330,Brighton,MA
org_000007,536001666,National Gallery Of Art,"Arts, Culture & Humanities",A,A510,Landover,MD
org_000008,530245017,John F Kennedy Center For The Performing Arts,"Arts, Culture & Humanities",A,A610,Washington,DC
org_000009,986000843,Canada Council For The Arts,"Arts, Culture & Humanities",A,A26Z,Canada,
org_000010,131624087,Metropolitan Opera Association Inc,"Arts, Culture & Humanities",A,A6A0,New York,NY
org_000011,942816342,Educational Media Foundation,"Arts, Culture & Humanities",A,A340,Rocklin,CA
org_000012,136162659,American Museum Of Natural History,"Arts, Culture & Humanities",A,A560,New York,NY
org_000013,741109655,Museum Of Fine Arts Houston,"Arts, Culture & Humanities",A,A510,Houston,TX
org_000014,42104397,Wgbh Educational Foundation,"Arts, Culture & Humanities",A,A300,Brighton,MA
org_000015,951696734,Los Angeles Philharmonic Association,"Arts, Culture & Humanities",A,A690,Los Angeles,CA
org_000016,42103916,Museum Of Science,"Arts, Culture & Humanities",A,A570,Boston,MA
org_000017,464950751,The Barack Obama Foundation,"Arts, Culture & Humanities",A,A80,Chicago,IL
org_000018,582106707,National Foundation For The Ctrs For Disease Contr & Prevention Inc,"Arts, Culture & Humanities",A,A50Z,Atlanta,GA
org_000019,951644589,Henry E Huntington Library & Art Gallery,"Arts, Culture & Humanities",A,A540,San Marino,CA
org_000020,383866410,Royal National Theatre,"Arts, Culture & Humanities",A,A65,New York,NY
org_000021,521309391,United States Holocaust Memorial Council,"Arts, Culture & Humanities",A,A540,Washington,DC
org_000022,131847137,Lincoln Center For The Performing Arts Inc,"Arts, Culture & Humanities",A,A610,New York,NY
org_000023,132655731,Sesame Workshop,"Arts, Culture & Humanities",A,A320,New York,NY
org_000024,832549505,Christo And Jeanne Claude Foundation,"Arts, Culture & Humanities",A,A51,New York,NY
org_000025,455600818,Lucas Museum Of Narrative Art,"Arts, Culture & Humanities",A,A50,Los Angeles,CA
org_000026,42103607,Museum Of Fine Arts,"Arts, Culture & Humanities",A,A510,Boston,MA
org_000027,521068522,Rfe Rl Inc,"Arts, Culture & Humanities",A,A34Z,Washington,DC
org_000028,952264067,Museum Associates,"Arts, Culture & Humanities",A,A51,Los Angeles,CA
org_000029,591022050,Museum Of Arts & Sciences,"Arts, Culture & Humanities",A,A500,Daytona Beach,FL
org_000030,540505888,Colonial Williamsburg Foundation,"Arts, Culture & Humanities",A,A800,Williamsburg,VA
org_000031,530242992,Greater Washington Educational Telecommunications Association Inc,"Arts, Culture & Humanities",A,A300,Arlington,VA
org_000032,262810489,Wnet,"Arts, Culture & Humanities",A,A32,New York,NY
org_000033,956102146,California Institute Of The Arts,"Arts, Culture & Humanities",A,A250,Valencia,CA
org_000034,580633971,Robert W Woodruff Arts Center Inc,"Arts, Culture & Humanities",A,A20,Atlanta,GA
org_000035,201359710,Crystal Bridges Museum Of American Art Inc,"Arts, Culture & Humanities",A,A51,Bentonville,AR
org_000036,952501387,The Colburn School,"Arts, Culture & Humanities",A,A6E0,Los Angeles,CA
org_000037,340714336,Cleveland Museum Of Art,"Arts, Culture & Humanities",A,A510,Cleveland,OH
org_000038,223848589,Epoch Times Association Inc,"Arts, Culture & Humanities",A,A23,New York,NY
org_000039,362167823,Chicago Symphony Orchestra,"Arts, Culture & Humanities",A,A690,Chicago,IL
org_000040,590454318,Society Of The Four Arts,"Arts, Culture & Humanities",A,A200,Palm Beach,FL
org_000041,42103550,Boston Symphony Orchestra Inc,"Arts, Culture & Humanities",A,A690,Boston,MA
org_000042,131789318,Whitney Museum Of American Art,"Arts, Culture & Humanities",A,A510,New York,NY
org_000043,250965280,Carnegie Institute,"Arts, Culture & Humanities",A,A500,Pittsburgh,PA
org_000044,362167011,Field Museum Of Natural History,"Arts, Culture & Humanities",A,A560,Chicago,IL
org_000045,131664054,Philharmonic Symphony Society Of New York Inc,"Arts, Culture & Humanities",A,A690,New York,NY
org_000046,943027961,Internews Network,"Arts, Culture & Humanities",A,A320,Arcata,CA
org_000047,941241309,Kqed Inc,"Arts, Culture & Humanities",A,A300,San Francisco,CA
org_000048,410953924,Minnesota Public Radio,"Arts, Culture & Humanities",A,A340,Saint Paul,MN
org_000049,237287150,Segerstrom Center For The Arts,"Arts, Culture & Humanities",A,A610,Costa Mesa,CA
org_000050,237169959,Coif Charities Investment Fund,"Arts, Culture & Humanities",A,A12,United Kingdom,
org_000051,133085180,Royal Shakespeare,"Arts, Culture & Humanities",A,A650,United Kingdom,
org_000052,530210807,National Trust For Historic Preservation In The United States,"Arts, Culture & Humanities",A,A800,Washington,DC
org_000053,940836240,San Francisco Opera Association,"Arts, Culture & Humanities",A,A6A0,San Francisco,CA
org_000054,872028034,Wisconsin Museum Of Nature And Culture Inc,"Arts, Culture & Humanities",A,A50,Milwaukee,WI
org_000055,874356146,Military Aviation Museum Foundation,"Arts, Culture & Humanities",A,A11,Virginia Bch,VA
org_000056,381359510,Detroit Institute Of Arts,"Arts, Culture & Humanities",A,A510,Detroit,MI
org_000057,721200790,National World War Ii Museum Inc,"Arts, Culture & Humanities",A,A540,New Orleans,LA
org_000058,344455780,1389 Superior Credit Union Inc,"Arts, Culture & Humanities",A,A30,Lima,OH
org_000059,381359513,The Edison Institute Inc,"Arts, Culture & Humanities",A,A540,Dearborn,MI
org_000060,410713907,Minnesota Historical Society,"Arts, Culture & Humanities",A,A800,Saint Paul,MN
org_000061,952040874,San Diego Symphony Orchestra Association,"Arts, Culture & Humanities",A,A690,San Diego,CA
org_000062,980408652,National Arts Centre Corporation,"Arts, Culture & Humanities",A,A60,Canada,
org_000063,232865855,Kimmel Center Inc,"Arts, Culture & Humanities",A,A600,Philadelphia,PA
org_000064,611745872,National September 11 Memorial And Museum At The World Trade Center,"Arts, Culture & Humanities",A,A84,New York,NY
org_000065,131923626,The Carnegie Hall Corporation,"Arts, Culture & Humanities",A,A610,New York,NY
org_000066,991576597,Strong Cuevas Sculpture Foundation,"Arts, Culture & Humanities",A,A99,Lynbrook,NY
org_000067,941156258,California Academy Of Sciences,"Arts, Culture & Humanities",A,A560,San Francisco,CA
org_000068,840407760,Denver Center For The Performing Arts,"Arts, Culture & Humanities",A,A610,Denver,CO
org_000069,132947386,New York City Ballet Inc,"Arts, Culture & Humanities",A,A630,New York,NY
org_000070,383678458,Natl Sept 11 Memorial And Museum At The World Trade Center Fdn Inc,"Arts, Culture & Humanities",A,A80,New York,NY
org_000071,135562233,Solomon R Guggenheim Foundation,"Arts, Culture & Humanities",A,A510,New York,NY
org_000072,952243698,Academy Foundation,"Arts, Culture & Humanities",A,A310,Beverly Hills,CA
org_000073,474365749,Alamo Trust Inc,"Arts, Culture & Humanities",A,A54,San Antonio,TX
org_000074,943130227,Seattle Theatre Group,"Arts, Culture & Humanities",A,A610,Seattle,WA
org_000075,350867985,Childrens Museum Of Indianapolis Incorporated,"Arts, Culture & Humanities",A,A520,Indianapolis,IN
org_000076,231352289,Philadelphia Orchestra Association,"Arts, Culture & Humanities",A,A690,Philadelphia,PA
org_000077,251469002,Pittsburgh Cultural Trust,"Arts, Culture & Humanities",A,A200,Pittsburgh,PA
org_000078,136192346,Roundabout Theatre Company Inc,"Arts, Culture & Humanities",A,A650,New York,NY
org_000079,237304942,Playhouse Square Foundation,"Arts, Culture & Humanities",A,A610,Cleveland,OH
org_000080,540564701,Mount Vernon Ladies Association Of The Union,"Arts, Culture & Humanities",A,A800,Mount Vernon,VA
org_000081,131656667,Manhattan School Of Music,"Arts, Culture & Humanities",A,A250,New York,NY
org_000082,231365388,Philadelphia Museum Of Art,"Arts, Culture & Humanities",A,A510,Philadelphia,PA
org_000083,340714468,The Musical Arts Association,"Arts, Culture & Humanities",A,A690,Cleveland,OH
org_000084,113533002,Friends Of United Hatzalah Inc,"Arts, Culture & Humanities",A,A70,New York,NY
org_000085,620606066,Country Music Association Inc,"Arts, Culture & Humanities",A,A68Z,Nashville,TN
org_000086,202605026,Academy Museum Foundation,"Arts, Culture & Humanities",A,A11,Beverly Hills,CA
org_000087,311378179,Music And Event Management Inc,"Arts, Culture & Humanities",A,A200,Cincinnati,OH
org_000088,222889703,New Jersey Performing Arts Center Corporation,"Arts, Culture & Humanities",A,A610,Newark,NJ
org_000089,910785826,Museum Of Flight Foundation,"Arts, Culture & Humanities",A,A110,Tukwila,WA
org_000090,521968145,Radio Free Asia,"Arts, Culture & Humanities",A,A340,Washington,DC
org_000091,956132185,Los Angeles County Museum Of Natural History Foundation,"Arts, Culture & Humanities",A,A116,Los Angeles,CA
org_000092,274813461,Navy Pier Inc,"Arts, Culture & Humanities",A,A80,Chicago,IL
org_000093,980033472,Royal Ontario Museum,"Arts, Culture & Humanities",A,A50Z,Canada,
org_000094,274026852,Crosswater Canyon Inc,"Arts, Culture & Humanities",A,A50,Petersburg,KY
org_000095,273641289,Academy Of Mathematics & Science South Inc,"Arts, Culture & Humanities",A,A25,Tempe,AZ
org_000096,133015230,New York Public Radio,"Arts, Culture & Humanities",A,A340,New York,NY
org_000097,720692744,New Orleans Jazz & Heritage Foundation Inc,"Arts, Culture & Humanities",A,A6C0,New Orleans,LA
org_000098,620753887,Country Music Foundation Inc,"Arts, Culture & Humanities",A,A500,Nashville,TN
org_000099,520749685,White House Historical Association,"Arts, Culture & Humanities",A,A82Z,Washington,DC
org_000100,510205333,Virginia Museum Of Fine Arts Foundation,"Arts, Culture & Humanities",A,A112,Richmond,VA
org_000101,941415298,San Francisco Ballet Association,"Arts, Culture & Humanities",A,A630,San Francisco,CA
org_000102,931824030,Golden Globe Foundation,"Arts, Culture & Humanities",A,A12,W Hollywood,CA
org_000103,391049688,Milwaukee World Festival Inc,"Arts, Culture & Humanities",A,A680,Milwaukee,WI
org_000104,510066038,Henry Francis Du Pont Winterthur Museum Inc,"Arts, Culture & Humanities",A,A510,Winterthur,DE
org_000105,111672743,Brooklyn Institute Of Arts And Sciences,"Arts, Culture & Humanities",A,A510,Brooklyn,NY
org_000106,941156284,San Francisco Symphony,"Arts, Culture & Humanities",A,A690,San Francisco,CA
org_000107,941696494,The Exploratorium,"Arts, Culture & Humanities",A,A500,San Francisco,CA
org_000108,952217011,Performing Arts Center Of Los Angeles County,"Arts, Culture & Humanities",A,A610,Los Angeles,CA
org_000109,362167797,Kenneth C Griffin Museum Of Science And Industry,"Arts, Culture & Humanities",A,A570,Chicago,IL
org_000110,366002273,Ravinia Festival Association,"Arts, Culture & Humanities",A,A600,Highland Park,IL
org_000111,381689022,Interlochen Center For The Arts,"Arts, Culture & Humanities",A,A25,Interlochen,MI
org_000112,833403946,San Antonio Valley Ranch Llc,"Arts, Culture & Humanities",A,A54,Petaluma,CA
org_000113,341520995,Rock And Roll Hall Of Fame And Museum Inc,"Arts, Culture & Humanities",A,A500,Cleveland,OH
org_000114,941156300,San Francisco Museum Of Modern Art,"Arts, Culture & Humanities",A,A510,San Francisco,CA
org_000115,142007220,Pro Publica Inc,"Arts, Culture & Humanities",A,A20,New York,NY
org_000116,530246894,Washington Drama Society Inc,"Arts, Culture & Humanities",A,A650,Washington,DC
org_000117,160758844,Chautauqua Institution,"Arts, Culture & Humanities",A,A610,Chautauqua,NY
org_000118,204144184,Kallir Family Foundation,"Arts, Culture & Humanities",A,A51,New York,NY
org_000119,237011544,Wolf Trap Foundation For The Performing Arts,"Arts, Culture & Humanities",A,A600,Vienna,VA
org_000120,131624124,New York Historical Society,"Arts, Culture & Humanities",A,A800,New York,NY
org_000121,200695917,Dr Phillips Center For The Performing Arts Inc,"Arts, Culture & Humanities",A,A11,Orlando,FL
org_000122,131844852,New York Shakespeare Festival,"Arts, Culture & Humanities",A,A650,New York,NY
org_000123,133004747,Vivian Beaumont Theater Inc,"Arts, Culture & Humanities",A,A650,New York,NY
org_000124,760276606,Woodlands Center For The Performing Arts,"Arts, Culture & Humanities",A,A60B,The Woodlands,TX
org_000125,42163004,Sterling & Francine Clark Art Inst,"Arts, Culture & Humanities",A,A510,Williamstown,MA
org_000126,952210527,California Science Center Foundation,"Arts, Culture & Humanities",A,A570,Los Angeles,CA
org_000127,752571525,Health Education Learning Project H E L P,"Arts, Culture & Humanities",A,A20,Fort Worth,TX
org_000128,541426643,American Battlefield Tr,"Arts, Culture & Humanities",A,A85Z,Washington,DC
org_000129,990109908,Polynesian Cultural Center,"Arts, Culture & Humanities",A,A230,Laie,HI
org_000130,942747262,San Francisco Ballet Endowment Foundation,"Arts, Culture & Humanities",A,A020,San Francisco,CA
org_000131,464386832,Cuyahoga County Convention Facilities Development Corporation,"Arts, Culture & Humanities",A,A20,Cleveland,OH
org_000132,840518447,The Colorado Museum Of Natural History,"Arts, Culture & Humanities",A,A560,Denver,CO
org_000133,943045948,Corporation Of The Fine Arts Museums,"Arts, Culture & Humanities",A,A035,San Francisco,CA
org_000134,366008929,Lyric Opera Of Chicago,"Arts, Culture & Humanities",A,A6A0,Chicago,IL
org_000135,446012977,Nelson Gallery Foundation,"Arts, Culture & Humanities",A,A510,Kansas City,MO
org_000136,250986052,Pittsburgh Symphony Inc,"Arts, Culture & Humanities",A,A690,Pittsburgh,PA
org_000137,581320590,Tennessee Performing Arts Center Management Corporation,"Arts, Culture & Humanities",A,A610,Nashville,TN
org_000138,800197489,Kaizen Educational Foundation,"Arts, Culture & Humanities",A,A12,Phoenix,AZ
org_000139,231473884,Mann Center For The Performing Arts,"Arts, Culture & Humanities",A,A610,Philadelphia,PA
org_000140,201476451,Pbs Foundation,"Arts, Culture & Humanities",A,A113,Arlington,VA
org_000141,410693929,Walker Art Center Inc,"Arts, Culture & Humanities",A,A200,Minneapolis,MN
org_000142,341580038,National Inventors Hall Of Fame Inc,"Arts, Culture & Humanities",A,A570,North Canton,OH
org_000143,310537080,Cincinnati Symphony Orchestra,"Arts, Culture & Humanities",A,A690,Cincinnati,OH
org_000144,132761376,Childrens Museum Of Manhattan,"Arts, Culture & Humanities",A,A520,New York,NY
org_000145,756036226,Kimbell Art Foundation,"Arts, Culture & Humanities",A,A20O,Fort Worth,TX
org_000146,911221895,Cascade Public Media,"Arts, Culture & Humanities",A,A320,Seattle,WA
org_000147,930814638,Oregon Public Broadcasting,"Arts, Culture & Humanities",A,A300,Portland,OR
org_000148,862022385,National Trust For Local News,"Arts, Culture & Humanities",A,A30,Brighton,CO
org_000149,810842855,Art Bridges Inc,"Arts, Culture & Humanities",A,A25,Bentonville,AR
org_000150,710647212,Walton Arts Center Council Inc,"Arts, Culture & Humanities",A,A260,Fayetteville,AR
org_000151,42312734,Boston Ballet Inc,"Arts, Culture & Humanities",A,A630,Boston,MA
org_000152,952466183,Center Theatre Group Of Los Angeles,"Arts, Culture & Humanities",A,A650,Los Angeles,CA
org_000153,136136259,Carnegie Hall Society Inc,"Arts, Culture & Humanities",A,A030,New York,NY
org_000154,540505959,Thomas Jefferson Foundation Inc,"Arts, Culture & Humanities",A,A540,Charlottesvle,VA
org_000155,231370501,Franklin Institute,"Arts, Culture & Humanities",A,A25,Philadelphia,PA
org_000156,650353695,Adrienne Arsht Center Trust Inc,"Arts, Culture & Humanities",A,A111,Miami,FL
org_000157,410769851,Twin Cities Public Television Inc,"Arts, Culture & Humanities",A,A320,Saint Paul,MN
org_000158,350867955,Indianapolis Museum Of Art Inc,"Arts, Culture & Humanities",A,A510,Indianapolis,IN
org_000159,843126447,Open Technology Fund,"Arts, Culture & Humanities",A,A05,Washington,DC
org_000160,952096402,Los Angeles Opera Company,"Arts, Culture & Humanities",A,A6A0,Los Angeles,CA
org_000161,742162248,Hope Media Group,"Arts, Culture & Humanities",A,A340,Humble,TX
org_000162,410693915,Minneapolis Society Of Fine Arts,"Arts, Culture & Humanities",A,A510,Minneapolis,MN
org_000163,923648739,Angela Duldulao Mcpherson Foundation,"Arts, Culture & Humanities",A,A50,Oxnard,CA
org_000164,581791724,North Carolina Performing Arts Center At Charlotte Foundation,"Arts, Culture & Humanities",A,A61,Charlotte,NC
org_000165,231438083,Whyy Inc,"Arts, Culture & Humanities",A,A300,Philadelphia,PA
org_000166,741036131,Houston Museum Of Natural Science,"Arts, Culture & Humanities",A,A560,Houston,TX
org_000167,132584273,Alvin Ailey Dance Foundation Inc,"Arts, Culture & Humanities",A,A620,New York,NY
org_000168,231585611,Curtis Institute Of Music,"Arts, Culture & Humanities",A,A6E0,Philadelphia,PA
org_000169,954664939,Broad Art Foundation,"Arts, Culture & Humanities",A,A51Z,Los Angeles,CA
org_000170,741394920,Houston Ballet Foundation,"Arts, Culture & Humanities",A,A630,Houston,TX
org_000171,871376165,Historic Haymarket Milwaukee I Inc,"Arts, Culture & Humanities",A,A50,Milwaukee,WI
org_000172,840751854,National Cable Satellite Corporation,"Arts, Culture & Humanities",A,A300,Washington,DC
org_000173,131851145,American Council Of Learned Societies,"Arts, Culture & Humanities",A,A030,New York,NY
org_000174,750808774,Dallas Museum Of Art,"Arts, Culture & Humanities",A,A510,Dallas,TX
org_000175,592245054,Raymond F Kravis Center For The Performing Arts Inc,"Arts, Culture & Humanities",A,A610,West Palm Bch,FL
org_000176,430666769,Saint Louis Symphony Orchestra,"Arts, Culture & Humanities",A,A690,Saint Louis,MO
org_000177,42104937,Society For The Preservation Of New England Antiquities Inc,"Arts, Culture & Humanities",A,A54,Haverhill,MA
org_000178,208812402,Shen Yun Performing Arts Inc,"Arts, Culture & Humanities",A,A60,Cuddebackvlle,NY
org_000179,160470118,The Wende Museum Of The Cold War Inc,"Arts, Culture & Humanities",A,A50,Culver City,CA
org_000180,470832480,Omaha Performing Arts Society,"Arts, Culture & Humanities",A,A60,Omaha,NE
org_000181,50252708,Preservation Society Of Newport County,"Arts, Culture & Humanities",A,A800,Newport,RI
org_000182,590915177,Cox Science Center And Aquarium Inc,"Arts, Culture & Humanities",A,A570,West Palm Bch,FL
org_000183,923558059,Sjc Cultural Events Inc,"Arts, Culture & Humanities",A,A60,St Augustine,FL
org_000184,133453405,Tate Americas Foundation,"Arts, Culture & Humanities",A,A115,New York,NY
org_000185,132590805,The Studio Museum In Harlem,"Arts, Culture & Humanities",A,A500,New York,NY
org_000186,112517055,Museum Of Chinese In The America,"Arts, Culture & Humanities",A,A500,New York,NY
org_000187,840445087,Music Associates Of Aspen Inc,"Arts, Culture & Humanities",A,A6E0,Aspen,CO
org_000188,900900556,Medal Of Honor Museum Foundation,"Arts, Culture & Humanities",A,A50,Arlington,TX
org_000189,580566162,Atlanta Historical Society Inc,"Arts, Culture & Humanities",A,A800,Atlanta,GA
org_000190,516020908,Brandywine Conservancy & Museum Of Art,"Arts, Culture & Humanities",A,A500,Chadds Ford,PA
org_000191,464598642,Borealis Philanthropy,"Arts, Culture & Humanities",A,A99,Minneapolis,MN
org_000192,870361394,Sundance Institute,"Arts, Culture & Humanities",A,A310,Park City,UT
org_000193,113451703,Fractured Atlas Inc,"Arts, Culture & Humanities",A,A65,New York,NY
org_000194,592322926,Artis Naples Inc,"Arts, Culture & Humanities",A,A610,Naples,FL
org_000195,846038240,Denver Art Museum Inc,"Arts, Culture & Humanities",A,A510,Denver,CO
org_000196,592603081,Florida West Coast Symphony Inc,"Arts, Culture & Humanities",A,A690,Sarasota,FL
org_000197,570811297,Peace Center Foundation,"Arts, Culture & Humanities",A,A610,Greenville,SC
org_000198,237397946,Dia Center For The Arts Inc,"Arts, Culture & Humanities",A,A200,New York,NY
org_000199,923725031,Fayetteville Performing Arts Center At Trilith,"Arts, Culture & Humanities",A,A20,Fayetteville,GA
org_000200,520629696,Baltimore Symphony Orchestra Inc,"Arts, Culture & Humanities",A,A690,Baltimore,MD
org_000201,841420029,Hale Centre Theatre,"Arts, Culture & Humanities",A,A650,Sandy,UT
org_000202,750705442,Dallas Symphony Association Inc,"Arts, Culture & Humanities",A,A690,Dallas,TX
org_000203,133888641,Jazz At Lincoln Center Inc,"Arts, Culture & Humanities",A,A680,New York,NY
org_000204,330901351,Jserra Catholic High School,"Arts, Culture & Humanities",A,A20,San Juan Capistrano,CA
org_000205,161743588,Musical Instrument Museum,"Arts, Culture & Humanities",A,A50,Phoenix,AZ
org_000206,131882106,Ballet Theatre Foundation Inc,"Arts, Culture & Humanities",A,A63Z,New York,NY
org_000207,752084961,North Texas Public Broadcasting Inc,"Arts, Culture & Humanities",A,A300,Dallas,TX
org_000208,381385132,Detroit Symphony Orchestra Hall Inc,"Arts, Culture & Humanities",A,A690,Detroit,MI
org_000209,232434447,National Constitution Center,"Arts, Culture & Humanities",A,A540,Philadelphia,PA
org_000210,314389673,Ohio Historical Society,"Arts, Culture & Humanities",A,A800,Columbus,OH
org_000211,650200989,Robert Rauschenberg Foundation,"Arts, Culture & Humanities",A,A90,New York,NY
org_000212,362246703,Window To The World Communications Inc,"Arts, Culture & Humanities",A,A320,Chicago,IL
org_000213,41988530,Worcester Art Museum,"Arts, Culture & Humanities",A,A510,Worcester,MA
org_000214,237122882,Close Up Foundation,"Arts, Culture & Humanities",A,A30,Arlington,VA
org_000215,330556416,Uss Midway Museum,"Arts, Culture & Humanities",A,A500,San Diego,CA
org_000216,610444640,American Printing House For The Blind Inc,"Arts, Culture & Humanities",A,A330,Louisville,KY
org_000217,133062419,Intrepid Museum Foundation Inc,"Arts, Culture & Humanities",A,A500,New York,NY
org_000218,952211661,Public Media Group Of Southern California,"Arts, Culture & Humanities",A,A320,Burbank,CA
org_000219,626063304,Memphis Brooks Museum Of Art Inc,"Arts, Culture & Humanities",A,A110,Memphis,TN
org_000220,412017278,Hennepin Theatre Tr,"Arts, Culture & Humanities",A,A65,Minneapolis,MN
org_000221,910640788,Seattle Art Museum,"Arts, Culture & Humanities",A,A510,Seattle,WA
org_000222,741157373,Houston Symphony Society,"Arts, Culture & Humanities",A,A690,Houston,TX
org_000223,410693875,Minnesota Orchestral Association,"Arts, Culture & Humanities",A,A690,Minneapolis,MN
org_000224,311728910,Navy Seal Foundation Inc,"Arts, Culture & Humanities",A,A54,Virginia Bch,VA
org_000225,592048869,Jorge M Perez Art Museum Of Miami Dade County Inc,"Arts, Culture & Humanities",A,A510,Miami,FL
org_000226,831772542,American Journalism Project Inc,"Arts, Culture & Humanities",A,A30,Washington,DC
org_000227,751104793,Broadway Dallas Inc,"Arts, Culture & Humanities",A,A610,Dallas,TX
org_000228,412024986,Common Sense Media,"Arts, Culture & Humanities",A,A99,San Francisco,CA
org_000229,131240132,Fox Theatre Inc,"Arts, Culture & Humanities",A,A800,Atlanta,GA
org_000230,430662485,Municipal Theatre Association Of St Louis,"Arts, Culture & Humanities",A,A650,Saint Louis,MO
org_000231,910897129,Pacific Northwest Ballet Association,"Arts, Culture & Humanities",A,A630,Seattle,WA
org_000232,880361875,The Smith Center For The Performing Arts,"Arts, Culture & Humanities",A,A61,Las Vegas,NV
org_000233,852458469,Cp 2023,"Arts, Culture & Humanities",A,A11,Philadelphia,PA
org_000234,756067569,Perot Museum Of Nature And Science,"Arts, Culture & Humanities",A,A560,Dallas,TX
org_000235,746045327,Menil Foundation Inc,"Arts, Culture & Humanities",A,A51,Houston,TX
org_000236,133118415,Statue Of Liberty Ellis Island Foundation Inc,"Arts, Culture & Humanities",A,A800,New York,NY
org_000237,316402408,Columbus Symphony Orchestra Inc,"Arts, Culture & Humanities",A,A690,Columbus,OH
org_000238,311127916,Radiant Life Ministries,"Arts, Culture & Humanities",A,A30Z,Marion,IL
org_000239,410706172,Science Museum Of Minnesota,"Arts, Culture & Humanities",A,A560,Saint Paul,MN
org_000240,410854160,Guthrie Theatre Foundation,"Arts, Culture & Humanities",A,A650,Minneapolis,MN
org_000241,463062871,Nc History Center On The Civil War Emancipation & Reconstruction,"Arts, Culture & Humanities",A,A54,Fayetteville,NC
org_000242,222302253,Liberty Science Center Inc,"Arts, Culture & Humanities",A,A570,Jersey City,NJ
org_000243,881571567,American Independent Media,"Arts, Culture & Humanities",A,A30,Washington,DC
org_000244,363687394,Chicago Public Media Inc,"Arts, Culture & Humanities",A,A340,Chicago,IL
org_000245,340898576,National Football Museum Inc,"Arts, Culture & Humanities",A,A500,Canton,OH
org_000246,310749884,Columbus Association For The Performing Arts Inc,"Arts, Culture & Humanities",A,A610,Columbus,OH
org_000247,941704765,Asian Art Museum Foundation Of San Francisco,"Arts, Culture & Humanities",A,A510,San Francisco,CA
org_000248,526072925,American Film Institute Inc,"Arts, Culture & Humanities",A,A310,Los Angeles,CA
org_000249,850131810,The Santa Fe Opera,"Arts, Culture & Humanities",A,A6A,Santa Fe,NM
org_000250,430654866,Missouri Historical Society Jefferson Memorial Building,"Arts, Culture & Humanities",A,A540,Saint Louis,MO
org_000251,390921093,Wisconsin History Foundation Inc,"Arts, Culture & Humanities",A,A118,Madison,WI
org_000252,454083198,Bethel Woods Center For The Arts Inc,"Arts, Culture & Humanities",A,A20,Liberty,NY
org_000253,390946025,Milwaukee Repertory Theater Inc,"Arts, Culture & Humanities",A,A650,Milwaukee,WI
